{
  "description": "Classifies intentional and reviewed Kubescape findings for repository manifests.",
  "schemaVersion": 1,
  "intentionalSecurityNegativeFixtures": [
    {
      "path": "src/infra/definitions/conformance/fixtures/security/security-findings-examples.test.k8s.yaml",
      "reason": "Scanner self-test fixture that deliberately enables host access, privilege escalation, and unsafe capabilities."
    }
  ],
  "ordinaryConformanceFixtureRules": [
    {
      "prefix": "src/infra/definitions/conformance/",
      "suffix": ".test.k8s.yaml",
      "reason": "Authored conformance input; findings remain scanned and reported but the manifest is not a deployable cluster resource."
    }
  ],
  "reviewedExceptions": [
    {
      "controlID": "C-0002",
      "controlName": "Prevent containers from allowing command execution",
      "kind": "Group",
      "namespace": "default",
      "reason": "Developer and operator groups require pod exec permissions for debugging and workspace interaction in team namespaces.",
      "name": "cluster:group:team:examples"
    },
    {
      "controlID": "C-0002",
      "controlName": "Prevent containers from allowing command execution",
      "kind": "Group",
      "namespace": "default",
      "reason": "Developer and operator groups require pod exec permissions for debugging and workspace interaction in team namespaces.",
      "name": "cluster:group:team:examples:dev"
    },
    {
      "controlID": "C-0002",
      "controlName": "Prevent containers from allowing command execution",
      "kind": "Group",
      "namespace": "default",
      "reason": "Developer and operator groups require pod exec permissions for debugging and workspace interaction in team namespaces.",
      "name": "cluster:group:team:fixtureteam"
    },
    {
      "controlID": "C-0002",
      "controlName": "Prevent containers from allowing command execution",
      "kind": "Group",
      "namespace": "default",
      "reason": "Developer and operator groups require pod exec permissions for debugging and workspace interaction in team namespaces.",
      "name": "cluster:group:team:fixtureteam:dev"
    },
    {
      "controlID": "C-0002",
      "controlName": "Prevent containers from allowing command execution",
      "kind": "ServiceAccount",
      "namespace": "default",
      "reason": "Synthetic networking probe requires pod exec capabilities to test ingress, egress, and container communication.",
      "name": "chainsaw-networking"
    },
    {
      "controlID": "C-0012",
      "controlName": "Applications credentials in configuration files",
      "kind": "CronJob",
      "namespace": "coder",
      "reason": "Coder template reconciler CronJob mounts Git authentication tokens via environment path references.",
      "name": "coder-template-reconciler"
    },
    {
      "controlID": "C-0012",
      "controlName": "Applications credentials in configuration files",
      "kind": "ConfigMap",
      "namespace": "coder",
      "reason": "Coder template reconciler config contains starter workspace templates.",
      "namePrefix": "coder-template-reconciler-"
    },
    {
      "controlID": "C-0012",
      "controlName": "Applications credentials in configuration files",
      "kind": "ConfigMap",
      "namespace": "coder",
      "reason": "Workspace healer configuration includes recovery scripts and endpoint credentials.",
      "namePrefix": "coder-workspace-healer-"
    },
    {
      "controlID": "C-0012",
      "controlName": "Applications credentials in configuration files",
      "kind": "ConfigMap",
      "namespace": "dex",
      "reason": "Synthetic identity check contains mock credentials for local login conformance validation.",
      "name": "dex-local-login-conformance"
    },
    {
      "controlID": "C-0012",
      "controlName": "Applications credentials in configuration files",
      "kind": "ConfigMap",
      "namespace": "kuberhealthy",
      "reason": "Chainsaw synthetic checks include mock credentials for identity provider validation.",
      "name": "chainsaw-identity-tests"
    },
    {
      "controlID": "C-0012",
      "controlName": "Applications credentials in configuration files",
      "kind": "ConfigMap",
      "namespace": "kuberhealthy",
      "reason": "Chainsaw synthetic checks configure observability endpoints and probe scripts.",
      "name": "chainsaw-observability-tests"
    },
    {
      "controlID": "C-0012",
      "controlName": "Applications credentials in configuration files",
      "kind": "ConfigMap",
      "namespace": "kuberhealthy",
      "reason": "Chainsaw synthetic checks use embedded test scripts and probe configurations.",
      "name": "chainsaw-smoke-check-scripts"
    },
    {
      "controlID": "C-0012",
      "controlName": "Applications credentials in configuration files",
      "kind": "ConfigMap",
      "namespace": "s3-system",
      "reason": "Rclone sync configuration references storage credentials managed by cell secrets.",
      "name": "s3-gateway-rclone-config"
    },
    {
      "controlID": "C-0012",
      "controlName": "Applications credentials in configuration files",
      "kind": "ConfigMap",
      "namespace": "s3-system",
      "reason": "Per-team rclone gateway configuration uses ambient pod credentials (env_auth); keys stay in cell secrets.",
      "namePrefix": "s3-gateway-"
    },
    {
      "controlID": "C-0012",
      "controlName": "Applications credentials in configuration files",
      "kind": "ConfigMap",
      "namespace": "signoz",
      "reason": "ClickHouse storage stats and schema scripts require database connection strings.",
      "name": "signoz-clickhouse-storage-stats-common"
    },
    {
      "controlID": "C-0012",
      "controlName": "Applications credentials in configuration files",
      "kind": "ConfigMap",
      "namespace": "signoz",
      "reason": "ClickHouse storage stats and schema scripts require database connection strings.",
      "name": "signoz-clickhouse-storage-stats-provider"
    },
    {
      "controlID": "C-0012",
      "controlName": "Applications credentials in configuration files",
      "kind": "ConfigMap",
      "namespace": "signoz",
      "reason": "ClickHouse storage stats and schema scripts require database connection strings.",
      "name": "signoz-clickhouse-storage-stats-rollup-program"
    },
    {
      "controlID": "C-0012",
      "controlName": "Applications credentials in configuration files",
      "kind": "ConfigMap",
      "namespace": "workspaces",
      "reason": "Workload origin configuration publishes authorized build and pull endpoints.",
      "name": "coder-workspace-origin"
    },
    {
      "controlID": "C-0012",
      "controlName": "Applications credentials in configuration files",
      "kind": "Deployment",
      "namespace": "s3-system",
      "reason": "S3 gateway team fixture deployments receive test credentials for multi-region conformance testing.",
      "name": "s3-gateway-fixture-team-cross-region"
    },
    {
      "controlID": "C-0012",
      "controlName": "Applications credentials in configuration files",
      "kind": "Deployment",
      "namespace": "s3-system",
      "reason": "S3 gateway team fixture deployments receive test credentials for local conformance testing.",
      "name": "s3-gateway-fixture-team-local"
    },
    {
      "controlID": "C-0012",
      "controlName": "Applications credentials in configuration files",
      "kind": "Deployment",
      "namespace": "s3-system",
      "reason": "S3 gateway team reader fixture deployments receive test credentials for local conformance testing.",
      "name": "s3-gateway-fixture-team-reader-local"
    },
    {
      "controlID": "C-0012",
      "controlName": "Applications credentials in configuration files",
      "kind": "Deployment",
      "namespace": "s3-system",
      "reason": "S3 gateway replication and stats workers receive storage endpoint parameters.",
      "name": "s3-gateway-org-workspace-backups-local"
    },
    {
      "controlID": "C-0012",
      "controlName": "Applications credentials in configuration files",
      "kind": "Deployment",
      "namespace": "s3-system",
      "reason": "S3 gateway replication and stats workers receive storage endpoint parameters.",
      "name": "s3-gateway-storage-stats-cross-region"
    },
    {
      "controlID": "C-0012",
      "controlName": "Applications credentials in configuration files",
      "kind": "Deployment",
      "namespace": "s3-system",
      "reason": "The legacy research data S3 gateway builds its rclone auth key from secret-backed environment references.",
      "name": "s3-gateway-legacy-research-data-local"
    },
    {
      "controlID": "C-0013",
      "controlName": "Non-root containers",
      "kind": "DaemonSet",
      "namespace": "parca",
      "reason": "Parca agent runs eBPF profilers requiring host system privileges.",
      "name": "parca-agent"
    },
    {
      "controlID": "C-0013",
      "controlName": "Non-root containers",
      "kind": "DaemonSet",
      "namespace": "parca",
      "reason": "Parca agent runs eBPF profilers requiring host system privileges.",
      "name": "parca-agent-gpu"
    },
    {
      "controlID": "C-0013",
      "controlName": "Non-root containers",
      "kind": "DaemonSet",
      "namespace": "node-problem-detector",
      "reason": "Node Problem Detector requires root access to read host /dev/kmsg, systemd units, and filesystem mounts.",
      "name": "node-problem-detector"
    },
    {
      "controlID": "C-0013",
      "controlName": "Non-root containers",
      "kind": "Deployment",
      "namespace": "atlantis",
      "reason": "Upstream proxy or catalog image runs as container default user.",
      "name": "atlantis-auth-proxy"
    },
    {
      "controlID": "C-0013",
      "controlName": "Non-root containers",
      "kind": "Deployment",
      "namespace": "default",